{
  "eventId": "41111111-1111-4111-8111-111111111111", "eventType": "task.assigned", "schemaVersion": 1,
  "tenantId": "tenant-byd", "correlationId": "corr-m21-assign", "causationId": "idem-m21-assign",
  "aggregateType": "Task", "aggregateId": "48888888-8888-4888-8888-888888888888", "aggregateVersion": 2,
  "occurredAt": "2026-07-14T04:00:00Z",
  "payload": {"taskId": "48888888-8888-4888-8888-888888888888", "assignmentBatchId": "49999999-9999-4999-8999-999999999999", "candidatePrincipalIds": ["technician-001", "technician-002"], "sourceType": "ASSIGNEE_POLICY", "sourceId": "policy://survey/technicians/v3", "assignedAt": "2026-07-14T04:00:00Z"}
}
